{
  "$schema": "./cloud-callback-receipt.production.schema.json",
  "projectId": "spmqtxqkdoxvtrkrfnnl",
  "overlaySha256": "9fafd7b12b381d4ed38b951ebe933dd92baf50cbe5439e583a0eda5b0c322ee4",
  "verifiedAt": "",
  "verifiedBy": "",
  "callbackUrls": [
    "neogym://verify",
    "neogym-dev://verify"
  ]
}
